{
  "id": "holiday-chickpea-sliders",
  "title": "Holiday Chickpea Sliders",
  "slug": "holiday-chickpea-sliders",
  "status": "draft",
  "tier": "free",
  "createdTimestamp": "2023-09-28T09:00:00Z",
  "updatedTimestamp": "2023-09-28T09:00:00Z",
  "publishedTimestamp": null,
  "source": "https://docs.google.com/document/d/1q6fbs_dz3Q8o6FLTnfCjgp1F82tONw45ZFoqHkPduPc/edit",
  "author": {
    "name": "Brian L. Patton",
    "contact": "thesexyvegan.com",
    "note": "Author of Sexy’s Best: The Vegan Fried Chicken of Your Dreams."
  },
  "description": "These Holiday Chickpea Sliders are a mouthwatering vegan delight that's perfect for holiday feasting. Crafted with a savory chickpea and nut patty, topped with a luscious cranberry sauce and quick rosemary gravy, and nestled within buttery slider buns, these mini burgers are a delightful fusion of flavors and textures. Whether served as an appetizer, entree, or a festive lunch, these sliders are a tasty addition to your holiday menu. Get ready to savor the season with these plant-based treats.",
  "quantity": "Makes 10 sliders",
  "tags": [
    "entree",
    "lunch",
    "dinner",
    "appetizer",
    "chickpea",
    "burger",
    "sliders"
  ],
  "photo": {
    "url": "https://photos.recipax.com/holiday-chickpea-sliders.jpg",
    "description": "Holiday Chickpea Sliders",
    "credit": ""
  },
  "ingredientGroups": [
    {
      "label": "For the quick rosemary gravy",
      "ingredients": [
        {
          "name": "all-purpose flour",
          "amount": "1 tablespoon",
          "preparation": null
        },
        {
          "name": "fresh rosemary",
          "amount": "¼ teaspoon",
          "preparation": "chopped"
        },
        {
          "name": "vegan butter",
          "amount": "1 tablespoon",
          "preparation": null
        },
        {
          "name": "vegan chicken broth",
          "amount": "1 cup",
          "preparation": "warmed"
        },
        {
          "name": "soy sauce",
          "amount": "2 teaspoons",
          "preparation": null
        },
        {
          "name": "granulated garlic",
          "amount": "⅛ teaspoon",
          "preparation": null
        },
        {
          "name": "granulated onion",
          "amount": "⅛ teaspoon",
          "preparation": null
        },
        {
          "name": "black pepper",
          "amount": "1⅙ teaspoon",
          "preparation": null
        }
      ]
    },
    {
      "label": "For the chickpea sliders",
      "ingredients": [
        {
          "name": "cooking spray",
          "amount": null,
          "preparation": "for greasing"
        },
        {
          "name": "chickpeas",
          "amount": "1 (14-ounce can)",
          "preparation": "drained"
        },
        {
          "name": "pecans",
          "amount": "¼ cup",
          "preparation": "chopped"
        },
        {
          "name": "walnuts",
          "amount": "¼ cup",
          "preparation": "chopped"
        },
        {
          "name": "onion",
          "amount": "¼ cup",
          "preparation": "diced"
        },
        {
          "name": "celery",
          "amount": "¼ cup",
          "preparation": "diced"
        },
        {
          "name": "carrot",
          "amount": "¼ cup",
          "preparation": "diced"
        },
        {
          "name": "button mushrooms",
          "amount": "1 cup",
          "preparation": "chopped"
        },
        {
          "name": "poultry seasoning",
          "amount": "2 tablespoons",
          "preparation": null
        },
        {
          "name": "nutritional yeast",
          "amount": "1 tablespoon",
          "preparation": null
        },
        {
          "name": "salt",
          "amount": "½ teaspoon",
          "preparation": null
        },
        {
          "name": "vital wheat gluten",
          "amount": "½ cup",
          "preparation": null
        },
        {
          "name": "cranberry sauce",
          "amount": "¼ cup",
          "preparation": null
        },
        {
          "name": "slider buns or Buttery Soft Dinner Rolls",
          "amount": "10",
          "preparation": "split in half"
        },
        {
          "name": "Quick Rosemary Gravy",
          "amount": null,
          "preparation": "see recipe"
        },
        {
          "name": "fresh Italian parsley",
          "amount": "2 tablespoons",
          "preparation": "chopped"
        }
      ]
    }
  ],
  "instructionSteps": [
    {
      "step": 1,
      "instructions": [
        "For the quick rosemary gravy, in a small skillet or saucepan over medium heat, add flour and rosemary. Stir continuously, 3 to 4 minutes, until flour is slightly toasted and rosemary is aromatic. Add butter and cook, stirring continuously for 2 minutes.",
        "Stir in broth, soy sauce, granulated garlic, granulated onion, and pepper. Once mixtures comes to a simmer, reduce heat to low, and cook 4 to 5 more minutes until thick enough to coat the back of a spoon. Keep warm until ready to use or reheat before serving."
      ]
    },
    {
      "step": 2,
      "instructions": [
        "Preheat oven to 400 degrees. Line a baking sheet with parchment paper and spray with cooking spray. In a bowl, add chickpeas and mash until smooth."
      ]
    },
    {
      "step": 3,
      "instructions": [
        "In a food processor, add pecans and walnuts. Pulse until finely ground, then add to bowl with mashed chickpeas.",
        "Into the food processor, add onion, celery, carrot, and mushrooms. Pulse until finely ground, then add to bowl with chickpea mixture. Add poultry seasoning, nutritional yeast, salt, and vital wheat gluten, and knead with your hands until ingredients are combined and all wheat gluten has been absorbed. Divide mixture into 10 equal portions, and form each into a golf ball-sized patty. Place on prepared baking sheet and spray tops of patties with cooking spray. Bake 40 minutes, flipping once halfway through."
      ]
    },
    {
      "step": 4,
      "instructions": [
        "To assemble sliders, spread 1 teaspoon cranberry sauce on bottom of each bun, followed by patties and 1 tablespoon gravy. Sprinkle parsley on top of gravy, and place top bun. Secure with sandwich picks, and serve."
      ]
    }
  ],
  "sidebars": [
    {
      "label": "Mash Up",
      "content": [
        "Chef Brian offers three creative ways to customize your sliders.\n\n",
        "**Hot potato**\n",
        "Add a dollop of our Best-Ever Mashed Potatoes before drizzling with gravy.\n\n",
        "**Sweet spot**",
        "Spoon a tablespoon of sweet potato casserole onto bottoms of buns.\n\n",
        "**Southern comfort**\n",
        "Add vegan mac and cheese, a dash of hot sauce, and smoky collard greens."
      ]
    }
  ]
}
